{
  "protocol_version": "0.4.0",
  "message_id": "11111111-1111-4111-8111-111111111111",
  "sent_at": "2026-07-27T09:00:00Z",
  "sender": {
    "component": "desktop",
    "instance_id": "desktop-main",
    "build_version": "0.4.0"
  },
  "trace": {
    "trace_id": "0123456789abcdef0123456789abcdef",
    "span_id": "0123456789abcdef",
    "sampled": true
  },
  "schema_id": "urn:glomancy:protocol:approval.request:1.0.0",
  "kind": "approval.request",
  "payload": {
    "approval_id": "55555555-5555-4555-8555-555555555555",
    "task_id": "22222222-2222-4222-8222-222222222222",
    "risk_level": "R3",
    "action_summary": "Blueprint üzerinde geri alınabilir yapısal değişiklik.",
    "consequences": [
      "Blueprint derlenecek.",
      "Değişiklik sonrası read-back yapılacak."
    ],
    "reversible": true,
    "expires_at": "2026-07-27T09:15:00Z"
  }
}
