{
  "protocol_version": "0.4.0",
  "message_id": "11111111-1111-4111-8111-111111111111",
  "sent_at": "2026-07-27T09:00:00Z",
  "sender": {
    "component": "desktop",
    "instance_id": "desktop-main",
    "build_version": "0.4.0"
  },
  "trace": {
    "trace_id": "0123456789abcdef0123456789abcdef",
    "span_id": "0123456789abcdef",
    "sampled": true
  },
  "schema_id": "urn:glomancy:protocol:task.submit:1.0.0",
  "kind": "task.submit",
  "payload": {
    "task_id": "22222222-2222-4222-8222-222222222222",
    "user_instruction": "Seçili Blueprint için güvenli bir dry-run planı oluştur.",
    "language": "tr-TR",
    "execution_mode": "dry-run",
    "risk_ceiling": "R2",
    "requested_capabilities": [
      "blueprint.read",
      "blueprint.plan"
    ],
    "context_refs": [
      {
        "source_type": "project",
        "uri": "glomancy://project/current",
        "revision": "workspace-1"
      }
    ],
    "idempotency_key": "task:22222222:attempt:1"
  }
}
