{
  "protocol_version": "0.4.0",
  "message_id": "11111111-1111-4111-8111-111111111111",
  "sent_at": "2026-07-27T09:00:00Z",
  "sender": {
    "component": "desktop",
    "instance_id": "desktop-main",
    "build_version": "0.4.0"
  },
  "trace": {
    "trace_id": "0123456789abcdef0123456789abcdef",
    "span_id": "0123456789abcdef",
    "sampled": true
  },
  "schema_id": "urn:glomancy:protocol:evidence.record:1.0.0",
  "kind": "evidence.record",
  "payload": {
    "evidence_id": "33333333-3333-4333-8333-333333333333",
    "task_id": "22222222-2222-4222-8222-222222222222",
    "evidence_type": "read-back",
    "captured_at": "2026-07-27T09:06:00Z",
    "producer": {
      "component": "validation-engine",
      "instance_id": "validator-01",
      "build_version": "0.4.0"
    },
    "sha256": "bbbbbbbbbbbbbbbbbbbbbbbbbbbbbbbbbbbbbbbbbbbbbbbbbbbbbbbbbbbbbbbb",
    "artifacts": [],
    "claims": [
      "Asset Registry sonucu beklenen varlıkla eşleşti."
    ]
  }
}
