{
  "protocol_version": "0.4.0",
  "message_id": "11111111-1111-4111-8111-111111111111",
  "sent_at": "2026-07-27T09:00:00Z",
  "sender": {
    "component": "desktop",
    "instance_id": "desktop-main",
    "build_version": "0.4.0"
  },
  "trace": {
    "trace_id": "0123456789abcdef0123456789abcdef",
    "span_id": "0123456789abcdef",
    "sampled": true
  },
  "schema_id": "urn:glomancy:protocol:approval.decision:1.0.0",
  "kind": "approval.decision",
  "payload": {
    "approval_id": "55555555-5555-4555-8555-555555555555",
    "task_id": "22222222-2222-4222-8222-222222222222",
    "decision": "approve",
    "decided_by": "user",
    "decided_at": "2026-07-27T09:05:00Z",
    "constraints": {
      "single_executor": true,
      "require_read_back": true
    }
  }
}
