{
  "protocol_version": "0.4.0",
  "message_id": "11111111-1111-4111-8111-111111111111",
  "sent_at": "2026-07-27T09:00:00Z",
  "sender": {
    "component": "desktop",
    "instance_id": "desktop-main",
    "build_version": "0.4.0"
  },
  "trace": {
    "trace_id": "0123456789abcdef0123456789abcdef",
    "span_id": "0123456789abcdef",
    "sampled": true
  },
  "schema_id": "urn:glomancy:protocol:heartbeat:1.0.0",
  "kind": "heartbeat",
  "payload": {
    "component": "bridge",
    "state": "ready",
    "active_task_id": null,
    "capabilities_sha256": "cccccccccccccccccccccccccccccccccccccccccccccccccccccccccccccccc",
    "observed_at": "2026-07-27T09:07:00Z"
  }
}
